{
  "version": "1.1.0",
  "stableRefVersion": "1",
  "source": {
    "sourceUrl": "fixture://research/navigation/api-reference",
    "sourceType": "fixture",
    "title": "API Reference"
  },
  "budget": {
    "requestedTokens": 512,
    "estimatedTokens": 71,
    "emittedTokens": 71,
    "truncated": false
  },
  "blocks": [
    {
      "version": "1.1.0",
      "id": "b1",
      "kind": "metadata",
      "ref": "rhead:metadata:api-reference",
      "role": "metadata",
      "text": "API Reference",
      "attributes": {
        "source": "title",
        "tagName": "title",
        "textLength": 13,
        "zone": "head"
      },
      "evidence": {
        "sourceUrl": "fixture://research/navigation/api-reference",
        "sourceType": "fixture",
        "domPathHint": "html > head"
      }
    },
    {
      "version": "1.1.0",
      "id": "b2",
      "kind": "link",
      "ref": "raside:link:overview",
      "role": "secondary-nav",
      "text": "Overview",
      "attributes": {
        "external": false,
        "href": "#overview",
        "tagName": "a",
        "textLength": 8,
        "zone": "aside"
      },
      "evidence": {
        "sourceUrl": "fixture://research/navigation/api-reference",
        "sourceType": "fixture",
        "domPathHint": "html > body > aside"
      }
    },
    {
      "version": "1.1.0",
      "id": "b3",
      "kind": "link",
      "ref": "raside:link:snapshot",
      "role": "secondary-nav",
      "text": "Snapshot",
      "attributes": {
        "external": false,
        "href": "#snapshot",
        "tagName": "a",
        "textLength": 8,
        "zone": "aside"
      },
      "evidence": {
        "sourceUrl": "fixture://research/navigation/api-reference",
        "sourceType": "fixture",
        "domPathHint": "html > body > aside"
      }
    },
    {
      "version": "1.1.0",
      "id": "b4",
      "kind": "link",
      "ref": "raside:link:evidence",
      "role": "secondary-nav",
      "text": "Evidence",
      "attributes": {
        "external": false,
        "href": "#evidence",
        "tagName": "a",
        "textLength": 8,
        "zone": "aside"
      },
      "evidence": {
        "sourceUrl": "fixture://research/navigation/api-reference",
        "sourceType": "fixture",
        "domPathHint": "html > body > aside"
      }
    },
    {
      "version": "1.1.0",
      "id": "b5",
      "kind": "heading",
      "ref": "rmain:heading:overview",
      "role": "content",
      "text": "API Reference",
      "attributes": {
        "level": 1,
        "tagName": "h1",
        "textLength": 13,
        "zone": "main"
      },
      "evidence": {
        "sourceUrl": "fixture://research/navigation/api-reference",
        "sourceType": "fixture",
        "domPathHint": "html > body > main"
      }
    },
    {
      "version": "1.1.0",
      "id": "b6",
      "kind": "text",
      "ref": "rmain:text:the-runtime-exposes-open-snapshot-extract-diff-c",
      "role": "content",
      "text": "The runtime exposes open, snapshot, extract, diff, compact, and replay commands.",
      "attributes": {
        "tagName": "p",
        "textLength": 80,
        "zone": "main"
      },
      "evidence": {
        "sourceUrl": "fixture://research/navigation/api-reference",
        "sourceType": "fixture",
        "domPathHint": "html > body > main"
      }
    },
    {
      "version": "1.1.0",
      "id": "b7",
      "kind": "heading",
      "ref": "rmain:heading:snapshot",
      "role": "content",
      "text": "Snapshot",
      "attributes": {
        "level": 2,
        "tagName": "h2",
        "textLength": 8,
        "zone": "main"
      },
      "evidence": {
        "sourceUrl": "fixture://research/navigation/api-reference",
        "sourceType": "fixture",
        "domPathHint": "html > body > main"
      }
    },
    {
      "version": "1.1.0",
      "id": "b8",
      "kind": "text",
      "ref": "rmain:text:snapshot-responses-include-stable-refs-and-evide",
      "role": "content",
      "text": "Snapshot responses include stable refs and evidence metadata.",
      "attributes": {
        "tagName": "p",
        "textLength": 61,
        "zone": "main"
      },
      "evidence": {
        "sourceUrl": "fixture://research/navigation/api-reference",
        "sourceType": "fixture",
        "domPathHint": "html > body > main"
      }
    },
    {
      "version": "1.1.0",
      "id": "b9",
      "kind": "heading",
      "ref": "rmain:heading:evidence",
      "role": "content",
      "text": "Evidence",
      "attributes": {
        "level": 2,
        "tagName": "h2",
        "textLength": 8,
        "zone": "main"
      },
      "evidence": {
        "sourceUrl": "fixture://research/navigation/api-reference",
        "sourceType": "fixture",
        "domPathHint": "html > body > main"
      }
    },
    {
      "version": "1.1.0",
      "id": "b10",
      "kind": "text",
      "ref": "rmain:text:evidence-blocks-must-point-back-to-the-supportin",
      "role": "content",
      "text": "Evidence blocks must point back to the supporting snapshot blocks.",
      "attributes": {
        "tagName": "p",
        "textLength": 66,
        "zone": "main"
      },
      "evidence": {
        "sourceUrl": "fixture://research/navigation/api-reference",
        "sourceType": "fixture",
        "domPathHint": "html > body > main"
      }
    }
  ]
}
