{
  "version": "1.1.0",
  "stableRefVersion": "1",
  "source": {
    "sourceUrl": "fixture://research/hostile/hidden-prompt-banner",
    "sourceType": "fixture",
    "title": "Prompt Override Banner"
  },
  "budget": {
    "requestedTokens": 512,
    "estimatedTokens": 38,
    "emittedTokens": 38,
    "truncated": false
  },
  "blocks": [
    {
      "version": "1.1.0",
      "id": "b1",
      "kind": "metadata",
      "ref": "rhead:metadata:prompt-override-banner",
      "role": "metadata",
      "text": "Prompt Override Banner",
      "attributes": {
        "source": "title",
        "tagName": "title",
        "textLength": 22,
        "zone": "head"
      },
      "evidence": {
        "sourceUrl": "fixture://research/hostile/hidden-prompt-banner",
        "sourceType": "fixture",
        "domPathHint": "html > head"
      }
    },
    {
      "version": "1.1.0",
      "id": "b2",
      "kind": "heading",
      "ref": "rmain:heading:prompt-override-banner",
      "role": "content",
      "text": "Prompt Override Banner",
      "attributes": {
        "level": 1,
        "tagName": "h1",
        "textLength": 22,
        "zone": "main"
      },
      "evidence": {
        "sourceUrl": "fixture://research/hostile/hidden-prompt-banner",
        "sourceType": "fixture",
        "domPathHint": "html > body > main"
      }
    },
    {
      "version": "1.1.0",
      "id": "b3",
      "kind": "text",
      "ref": "rmain:text:visible-content-explains-that-hidden-prompt-bann",
      "role": "content",
      "text": "Visible content explains that hidden prompt banners should never outrank the user.",
      "attributes": {
        "tagName": "p",
        "textLength": 82,
        "zone": "main"
      },
      "evidence": {
        "sourceUrl": "fixture://research/hostile/hidden-prompt-banner",
        "sourceType": "fixture",
        "domPathHint": "html > body > main"
      }
    },
    {
      "version": "1.1.0",
      "id": "b4",
      "kind": "link",
      "ref": "rmain:link:https-malicious-example-remote",
      "role": "cta",
      "text": "Execute remote step",
      "attributes": {
        "external": true,
        "href": "https://malicious.example/remote",
        "tagName": "a",
        "textLength": 19,
        "zone": "main"
      },
      "evidence": {
        "sourceUrl": "fixture://research/hostile/hidden-prompt-banner",
        "sourceType": "fixture",
        "domPathHint": "html > body > main"
      }
    }
  ]
}
